{
  "schema_version": 1,
  "incident_id": "66666666-6666-4666-8666-666666666666",
  "state": "response_active",
  "invitation": {
    "schema_version": 1,
    "invitation_id": "cccccccc-cccc-4ccc-8ccc-cccccccccccc",
    "incident_id": "66666666-6666-4666-8666-666666666666",
    "sequence": 2,
    "responder": {
      "schema_version": 1,
      "responder_id": "22222222-2222-4222-8222-222222222222",
      "display_name": "Jordan K.",
      "role": "trained_volunteer",
      "skills": ["first_aid", "aed"],
      "rank": 2,
      "distance_band": "100_to_250_m",
      "available": true,
      "location_updated_at": "2026-07-18T14:32:18Z"
    },
    "status": "accepted",
    "invited_at": "2026-07-18T14:32:26Z",
    "responded_at": "2026-07-18T14:32:30Z",
    "decision_id": "eeeeeeee-eeee-4eee-8eee-eeeeeeeeeeee"
  },
  "wearer_location": {
    "latitude": 41.8781,
    "longitude": -87.6298,
    "horizontal_accuracy_m": 8.0,
    "captured_at": "2026-07-18T14:32:05Z"
  },
  "aed": {
    "schema_version": 1,
    "aed_site_id": "aaaaaaaa-aaaa-4aaa-8aaa-aaaaaaaaaaaa",
    "name": "Main Hall AED",
    "coordinate": {
      "latitude": 41.87845,
      "longitude": -87.62955
    },
    "location_description": "Main hall, east wall beside the information desk",
    "access_instructions": "Enter through the main hall doors; the cabinet is marked AED.",
    "publicly_accessible": true,
    "available": true,
    "availability_confirmed_at": "2026-07-18T13:00:00Z"
  },
  "route": {
    "schema_version": 1,
    "route_id": "12121212-1212-4212-8212-121212121212",
    "source": "static_fallback",
    "provider": "static_venue",
    "fallback_reason": "provider_not_configured",
    "travel_mode": "walking",
    "aed_site_id": "aaaaaaaa-aaaa-4aaa-8aaa-aaaaaaaaaaaa",
    "created_at": "2026-07-18T14:32:30Z",
    "legs": [
      {
        "sequence": 1,
        "leg_type": "responder_to_aed",
        "origin": {
          "latitude": 41.879,
          "longitude": -87.6289
        },
        "destination": {
          "latitude": 41.87845,
          "longitude": -87.62955
        },
        "instruction": "Walk southwest to the main hall information desk and retrieve the marked AED.",
        "distance_m": 119.3,
        "estimated_duration_seconds": 88,
        "geometry": [
          {
            "latitude": 41.879,
            "longitude": -87.6289
          },
          {
            "latitude": 41.87845,
            "longitude": -87.62955
          }
        ]
      },
      {
        "sequence": 2,
        "leg_type": "aed_to_wearer",
        "origin": {
          "latitude": 41.87845,
          "longitude": -87.62955
        },
        "destination": {
          "latitude": 41.8781,
          "longitude": -87.6298
        },
        "instruction": "Take the AED west through the main hall to the marked incident point.",
        "distance_m": 44.2,
        "estimated_duration_seconds": 38,
        "geometry": [
          {
            "latitude": 41.87845,
            "longitude": -87.62955
          },
          {
            "latitude": 41.8781,
            "longitude": -87.6298
          }
        ]
      }
    ],
    "total_distance_m": 163.5,
    "estimated_duration_seconds": 126
  },
  "activated_at": "2026-07-18T14:32:30Z",
  "simulated": false
}
